{
  "$schema": "https://json-schema.org/draft/2020-12/schema",
  "$id": "urn:a-conductor:schema:hook-contract:1.0.0",
  "title": "A-Sunday Conductor Hook Contract v1",
  "description": "Normalized hook/event envelope for A-Sunday Conductor, SRM, and harness adapters. Whole-envelope UTF-8 size SHOULD be <= 32768 bytes and MUST be <= 65536 bytes; size caps are consumer-enforced (HOOK_EVENT_OVERSIZED). Raw prompts, credentials, cookies, session/share URLs, and unrestricted command lines are forbidden fields; any envelope carrying them is security-invalid (HOOK_EVENT_INVALID).",
  "type": "object",
  "additionalProperties": false,
  "required": [
    "schema_version",
    "event_id",
    "event_type",
    "hook_class",
    "phase",
    "domain",
    "action",
    "occurred_at",
    "source",
    "source_version",
    "device_id",
    "host_os",
    "privacy_class"
  ],
  "properties": {
    "schema_version": {
      "type": "string",
      "pattern": "^1\\.\\d+\\.\\d+$",
      "maxLength": 16
    },
    "event_id": {
      "type": "string",
      "pattern": "^hk-[0-9a-f]{32}$",
      "maxLength": 35
    },
    "event_type": {
      "type": "string",
      "pattern": "^[a-z][a-z0-9_]*(\\.[a-z][a-z0-9_]*){1,2}$",
      "maxLength": 96
    },
    "hook_class": {
      "enum": ["OBSERVE", "ADVISORY", "GUARD", "COMMAND"]
    },
    "phase": {
      "enum": ["before", "after", "within", "terminal"]
    },
    "domain": {
      "enum": [
        "control",
        "execution",
        "process",
        "tool",
        "workspace",
        "batch",
        "semantic",
        "transport",
        "device",
        "advisory",
        "security"
      ]
    },
    "action": {
      "type": "string",
      "pattern": "^[a-z][a-z0-9_]{0,31}$"
    },
    "occurred_at": {
      "type": "string",
      "pattern": "^\\d{4}-\\d{2}-\\d{2}T\\d{2}:\\d{2}:\\d{2}(\\.\\d{1,9})?Z$",
      "maxLength": 32
    },
    "source": {
      "enum": ["a-conductor", "srm", "claude-code", "kilo", "rdc"]
    },
    "source_version": {
      "type": "string",
      "pattern": "^\\d+\\.\\d+\\.\\d+(-[0-9A-Za-z.-]+)?$",
      "maxLength": 64
    },
    "device_id": {
      "type": "string",
      "pattern": "^[A-Za-z0-9][A-Za-z0-9._-]{0,63}$",
      "maxLength": 64
    },
    "host_os": {
      "enum": ["windows", "macos", "linux"]
    },
    "privacy_class": {
      "enum": ["PUBLIC", "INTERNAL", "SENSITIVE"]
    },
    "lane_id": {
      "type": "string",
      "pattern": "^[A-Za-z0-9][A-Za-z0-9._:-]{0,63}$",
      "maxLength": 64
    },
    "task_id": {
      "type": "string",
      "pattern": "^[A-Za-z0-9][A-Za-z0-9._:-]{0,63}$",
      "maxLength": 64
    },
    "work_order": {
      "type": "string",
      "pattern": "^[A-Za-z0-9][A-Za-z0-9._:-]{0,63}$",
      "maxLength": 64
    },
    "task_topology": {
      "enum": [
        "CONTROL_PLANE_ONLY",
        "EXECUTION_SUBSTRATE_ONLY",
        "CROSS_REPO",
        "UNBOUND"
      ]
    },
    "authority_repo": {
      "type": "string",
      "minLength": 1,
      "maxLength": 256
    },
    "execution_repo": {
      "type": "string",
      "minLength": 1,
      "maxLength": 256
    },
    "repo": {
      "type": "string",
      "minLength": 1,
      "maxLength": 256
    },
    "worktree": {
      "type": "string",
      "minLength": 1,
      "maxLength": 256
    },
    "branch": {
      "type": "string",
      "pattern": "^[^\\s]{1,256}$",
      "maxLength": 256
    },
    "head_sha": {
      "type": "string",
      "pattern": "^[0-9a-f]{7,64}$",
      "maxLength": 64
    },
    "claim_ref": {
      "type": "string",
      "pattern": "^[A-Za-z0-9][A-Za-z0-9._:/-]{0,127}$",
      "maxLength": 128
    },
    "execution_id": {
      "type": "string",
      "pattern": "^[A-Za-z0-9][A-Za-z0-9._:/-]{0,127}$",
      "maxLength": 128
    },
    "harness_id": {
      "type": "string",
      "pattern": "^[A-Za-z0-9][A-Za-z0-9._:/-]{0,127}$",
      "maxLength": 128
    },
    "model_id": {
      "type": "string",
      "pattern": "^[A-Za-z0-9][A-Za-z0-9._:/-]{0,127}$",
      "maxLength": 128
    },
    "effort": {
      "type": "string",
      "pattern": "^[a-z0-9][a-z0-9._-]{0,31}$",
      "maxLength": 32
    },
    "state": {
      "type": "string",
      "pattern": "^[A-Z][A-Z0-9_]{1,31}$",
      "maxLength": 32
    },
    "duration_ms": {
      "type": "integer",
      "minimum": 0,
      "maximum": 2147483647
    },
    "blocker_code": {
      "type": "string",
      "pattern": "^[A-Z][A-Z0-9_]{1,63}$",
      "maxLength": 64
    },
    "sequence": {
      "type": "integer",
      "minimum": 0,
      "maximum": 9007199254740991
    },
    "dedupe_key": {
      "type": "string",
      "pattern": "^[A-Za-z0-9][A-Za-z0-9._:-]{0,127}$",
      "maxLength": 128
    },
    "correlation_id": {
      "type": "string",
      "pattern": "^[A-Za-z0-9][A-Za-z0-9._:-]{0,127}$",
      "maxLength": 128
    },
    "causation_id": {
      "type": "string",
      "pattern": "^hk-[0-9a-f]{32}$",
      "maxLength": 35
    },
    "evidence_refs": {
      "type": "array",
      "maxItems": 16,
      "uniqueItems": true,
      "items": {
        "type": "string",
        "pattern": "^[A-Za-z0-9][A-Za-z0-9._:/-]{0,255}$",
        "maxLength": 256
      }
    },
    "evidence_digest": {
      "type": "string",
      "pattern": "^[0-9a-f]{16,128}$",
      "maxLength": 128
    },
    "summary": {
      "type": "string",
      "minLength": 1,
      "maxLength": 512
    },
    "command_digest": {
      "type": "string",
      "pattern": "^[0-9a-f]{16,128}$",
      "maxLength": 128
    },
    "command_ref": {
      "type": "string",
      "pattern": "^[A-Za-z0-9][A-Za-z0-9._:-]{0,127}$",
      "maxLength": 128
    },
    "guard": {
      "type": "object",
      "additionalProperties": false,
      "required": ["failure_policy", "security_scope", "authority_scope"],
      "properties": {
        "failure_policy": {
          "enum": ["FAIL_CLOSED", "FAIL_OPEN"]
        },
        "security_scope": {
          "type": "boolean"
        },
        "authority_scope": {
          "type": "boolean"
        },
        "policy_ref": {
          "type": "string",
          "pattern": "^[A-Za-z0-9][A-Za-z0-9._:/-]{0,255}$",
          "maxLength": 256
        }
      }
    },
    "command_request": {
      "type": "object",
      "additionalProperties": false,
      "required": ["request_id", "command"],
      "properties": {
        "request_id": {
          "type": "string",
          "pattern": "^[A-Za-z0-9][A-Za-z0-9._:-]{0,127}$",
          "maxLength": 128
        },
        "command": {
          "enum": [
            "pause",
            "cancel",
            "retry",
            "recover",
            "reassign",
            "release_lane",
            "cleanup_request",
            "merge_request"
          ]
        },
        "target_ref": {
          "type": "string",
          "pattern": "^[A-Za-z0-9][A-Za-z0-9._:-]{0,127}$",
          "maxLength": 128
        },
        "justification": {
          "type": "string",
          "minLength": 1,
          "maxLength": 512
        }
      }
    },
    "adapter": {
      "type": "object",
      "additionalProperties": false,
      "required": [
        "adapter_id",
        "adapter_version",
        "contract_version",
        "emits",
        "redaction_policy",
        "supports_sequence"
      ],
      "properties": {
        "adapter_id": {
          "type": "string",
          "pattern": "^[A-Za-z0-9][A-Za-z0-9._:-]{0,63}$",
          "maxLength": 64
        },
        "adapter_version": {
          "type": "string",
          "pattern": "^\\d+\\.\\d+\\.\\d+(-[0-9A-Za-z.-]+)?$",
          "maxLength": 64
        },
        "contract_version": {
          "type": "string",
          "pattern": "^1\\.\\d+\\.\\d+$",
          "maxLength": 16
        },
        "emits": {
          "type": "array",
          "maxItems": 64,
          "uniqueItems": true,
          "items": {
            "type": "string",
            "pattern": "^[a-z][a-z0-9_]*(\\.[a-z][a-z0-9_]*){1,2}$",
            "maxLength": 96
          }
        },
        "redaction_policy": {
          "type": "string",
          "pattern": "^[a-z0-9][a-z0-9._/-]{0,63}$",
          "maxLength": 64
        },
        "supports_sequence": {
          "type": "boolean"
        }
      }
    }
  },
  "allOf": [
    {
      "if": {
        "properties": {"hook_class": {"const": "GUARD"}},
        "required": ["hook_class"]
      },
      "then": {"required": ["guard"]}
    },
    {
      "if": {
        "not": {
          "properties": {"hook_class": {"const": "GUARD"}},
          "required": ["hook_class"]
        }
      },
      "then": {"properties": {"guard": false}}
    },
    {
      "if": {
        "properties": {"hook_class": {"const": "COMMAND"}},
        "required": ["hook_class"]
      },
      "then": {"required": ["command_request"]}
    },
    {
      "if": {
        "not": {
          "properties": {"hook_class": {"const": "COMMAND"}},
          "required": ["hook_class"]
        }
      },
      "then": {"properties": {"command_request": false}}
    },
    {
      "if": {
        "not": {
          "properties": {"hook_class": {"const": "OBSERVE"}},
          "required": ["hook_class"]
        }
      },
      "then": {"properties": {"adapter": false}}
    },
    {
      "if": {
        "properties": {
          "guard": {
            "anyOf": [
              {
                "properties": {"security_scope": {"const": true}},
                "required": ["security_scope"]
              },
              {
                "properties": {"authority_scope": {"const": true}},
                "required": ["authority_scope"]
              }
            ]
          }
        },
        "required": ["guard"]
      },
      "then": {
        "properties": {
          "guard": {
            "properties": {"failure_policy": {"const": "FAIL_CLOSED"}}
          }
        }
      }
    }
  ]
}
