[
  {
    "schema_version": "1.0.0",
    "event_id": "hk-00000000000040008000000000000000",
    "event_type": "transport.adapter_capabilities",
    "hook_class": "OBSERVE",
    "phase": "before",
    "domain": "transport",
    "action": "adapter_capabilities",
    "occurred_at": "2026-09-19T08:40:00Z",
    "source": "kilo",
    "source_version": "7.7.2",
    "device_id": "device-01",
    "host_os": "windows",
    "privacy_class": "INTERNAL",
    "dedupe_key": "kilo:adapter-capabilities:1.0.0",
    "adapter": {
      "adapter_id": "kilo-hook-adapter",
      "adapter_version": "1.0.0",
      "contract_version": "1.0.0",
      "emits": [
        "transport.adapter_capabilities",
        "execution.step_start",
        "execution.message",
        "tool.execute.before",
        "tool.execute.after"
      ],
      "redaction_policy": "fake-secret-corpus/1",
      "supports_sequence": false
    }
  },
  {
    "schema_version": "1.0.0",
    "event_id": "hk-00000000000140018000000000000001",
    "event_type": "tool.execute.before",
    "hook_class": "OBSERVE",
    "phase": "before",
    "domain": "tool",
    "action": "execute",
    "occurred_at": "2026-09-19T09:01:00Z",
    "source": "kilo",
    "source_version": "7.7.2",
    "device_id": "device-01",
    "host_os": "windows",
    "privacy_class": "INTERNAL",
    "harness_id": "kilo-cli",
    "model_id": "cointh-glm/glm-5.3",
    "correlation_id": "kilo-fixture-session-0002",
    "dedupe_key": "kilo:kilo-fixture-session-0002:040eb5222c6663f2",
    "evidence_refs": [
      "runs/WO-P1-262/author/attempt-0001/kilo-sanitized.ndjson:L1"
    ],
    "evidence_digest": "040eb5222c6663f2c8d3de69da539e9891fb002982cff4ccc8c3b2d6d9d9a71c",
    "command_digest": "f50e8eb2732eba473ab663ad3d02fc539728cd5c1a838dbe6fc8d62ecdd641d9",
    "summary": "kilo tool bash running (input redacted)"
  },
  {
    "schema_version": "1.0.0",
    "event_id": "hk-00000000000240028000000000000002",
    "event_type": "tool.execute.after",
    "hook_class": "OBSERVE",
    "phase": "after",
    "domain": "tool",
    "action": "execute",
    "occurred_at": "2026-09-19T09:01:01Z",
    "source": "kilo",
    "source_version": "7.7.2",
    "device_id": "device-01",
    "host_os": "windows",
    "privacy_class": "INTERNAL",
    "harness_id": "kilo-cli",
    "model_id": "cointh-glm/glm-5.3",
    "correlation_id": "kilo-fixture-session-0002",
    "dedupe_key": "kilo:kilo-fixture-session-0002:3b5a16669f6768de",
    "evidence_refs": [
      "runs/WO-P1-262/author/attempt-0001/kilo-sanitized.ndjson:L2"
    ],
    "evidence_digest": "3b5a16669f6768de9080ae05f8a1626cae27979ca21be02d53dd7242792bac15",
    "command_digest": "abeacf9bd5a098a69efd8913b72b7f77a0308bcac98b91b6f5cd76d98424e514",
    "summary": "kilo tool edit completed (input/output redacted)"
  },
  {
    "schema_version": "1.0.0",
    "event_id": "hk-00000000000340038000000000000003",
    "event_type": "execution.message",
    "hook_class": "OBSERVE",
    "phase": "within",
    "domain": "execution",
    "action": "message",
    "occurred_at": "2026-09-19T09:01:02Z",
    "source": "kilo",
    "source_version": "7.7.2",
    "device_id": "device-01",
    "host_os": "windows",
    "privacy_class": "INTERNAL",
    "harness_id": "kilo-cli",
    "model_id": "cointh-glm/glm-5.3",
    "correlation_id": "kilo-fixture-session-0002",
    "dedupe_key": "kilo:kilo-fixture-session-0002:06b1bc1cba500486",
    "evidence_refs": [
      "runs/WO-P1-262/author/attempt-0001/kilo-sanitized.ndjson:L3"
    ],
    "evidence_digest": "06b1bc1cba50048601505607bedd46eb484dcc0c138d5f858b0cdfdfde45fbad",
    "summary": "kilo text part (redacted, digest only)"
  },
  {
    "schema_version": "1.0.0",
    "event_id": "hk-00000000000440048000000000000004",
    "event_type": "tool.execute.before",
    "hook_class": "OBSERVE",
    "phase": "before",
    "domain": "tool",
    "action": "execute",
    "occurred_at": "2026-09-19T09:01:03Z",
    "source": "kilo",
    "source_version": "7.7.2",
    "device_id": "device-01",
    "host_os": "windows",
    "privacy_class": "INTERNAL",
    "harness_id": "kilo-cli",
    "model_id": "cointh-glm/glm-5.3",
    "correlation_id": "kilo-fixture-session-0002",
    "dedupe_key": "kilo:kilo-fixture-session-0002:2a5c962bb72b928d",
    "evidence_refs": [
      "runs/WO-P1-262/author/attempt-0001/kilo-sanitized.ndjson:L4"
    ],
    "evidence_digest": "2a5c962bb72b928dec770a22b759959beee548ca95c644cd7beb255b0cab0c7d",
    "command_digest": "cbada3ef1e9407dfb7bd15e98b13de20c26afbbf567f19f7ca46094e2d44addb",
    "summary": "kilo tool bash running (input redacted)"
  },
  {
    "schema_version": "1.0.0",
    "event_id": "hk-00000000000540058000000000000005",
    "event_type": "tool.execute.after",
    "hook_class": "OBSERVE",
    "phase": "after",
    "domain": "tool",
    "action": "execute",
    "occurred_at": "2026-09-19T09:01:04Z",
    "source": "kilo",
    "source_version": "7.7.2",
    "device_id": "device-01",
    "host_os": "windows",
    "privacy_class": "INTERNAL",
    "harness_id": "kilo-cli",
    "model_id": "cointh-glm/glm-5.3",
    "correlation_id": "kilo-fixture-session-0002",
    "dedupe_key": "kilo:kilo-fixture-session-0002:018ecead368f7c71",
    "evidence_refs": [
      "runs/WO-P1-262/author/attempt-0001/kilo-sanitized.ndjson:L5"
    ],
    "evidence_digest": "018ecead368f7c71819a16a55a6cbbe527f98d1d8a7349ed23d150601a18d2cb",
    "command_digest": "84438c7a3c8e84808b05cc89c4a48040f3518d80ccdf7e268fbe6d0f7fa9847b",
    "summary": "kilo tool grep completed (input/output redacted)"
  }
]
