{
  "schema_version": "1.0.0",
  "event_id": "hk-09090909090909090909090909090909",
  "event_type": "execution.agent_stopped",
  "hook_class": "OBSERVE",
  "phase": "after",
  "domain": "execution",
  "action": "agent_stopped",
  "occurred_at": "2026-09-19T08:44:55.500Z",
  "source": "claude-code",
  "source_version": "0.0.0-fixture-a",
  "device_id": "device-fx-01",
  "host_os": "windows",
  "privacy_class": "INTERNAL",
  "correlation_id": "fx-session-0001",
  "execution_id": "fx-turn-0007",
  "model_id": "fx-model-a",
  "duration_ms": 30500,
  "summary": "agent turn stopped"
}
