{
  "schema_version": "1.0.0",
  "event_id": "hk-07070707070707070707070707070707",
  "event_type": "execution.subagent_started",
  "hook_class": "OBSERVE",
  "phase": "within",
  "domain": "execution",
  "action": "subagent_started",
  "occurred_at": "2026-09-19T08:15:00Z",
  "source": "claude-code",
  "source_version": "0.0.0-fixture-a",
  "device_id": "device-fx-01",
  "host_os": "windows",
  "privacy_class": "INTERNAL",
  "correlation_id": "fx-session-0001",
  "execution_id": "fx-subagent-01",
  "model_id": "fx-model-a",
  "summary": "subagent started"
}
