[
  {
    "schema_version": "1.0.0",
    "event_id": "hk-00000000000040008000000000000000",
    "event_type": "transport.adapter_capabilities",
    "hook_class": "OBSERVE",
    "phase": "before",
    "domain": "transport",
    "action": "adapter_capabilities",
    "occurred_at": "2026-09-19T08:40:00Z",
    "source": "kilo",
    "source_version": "7.7.2",
    "device_id": "device-01",
    "host_os": "windows",
    "privacy_class": "INTERNAL",
    "dedupe_key": "kilo:adapter-capabilities:1.0.0",
    "adapter": {
      "adapter_id": "kilo-hook-adapter",
      "adapter_version": "1.0.0",
      "contract_version": "1.0.0",
      "emits": [
        "transport.adapter_capabilities",
        "execution.step_start",
        "execution.message",
        "tool.execute.before",
        "tool.execute.after"
      ],
      "redaction_policy": "fake-secret-corpus/1",
      "supports_sequence": false
    }
  },
  {
    "schema_version": "1.0.0",
    "event_id": "hk-00000000000140018000000000000001",
    "event_type": "execution.step_start",
    "hook_class": "OBSERVE",
    "phase": "within",
    "domain": "execution",
    "action": "step_start",
    "occurred_at": "2026-09-19T08:41:05.123Z",
    "source": "kilo",
    "source_version": "7.7.2",
    "device_id": "device-01",
    "host_os": "windows",
    "privacy_class": "INTERNAL",
    "harness_id": "kilo-cli",
    "model_id": "cointh-glm/glm-5.3",
    "correlation_id": "kilo-fixture-session-0001",
    "dedupe_key": "kilo:kilo-fixture-session-0001:b69b3a20b9371ee1",
    "evidence_refs": [
      "runs/WO-P1-262/author/attempt-0001/kilo-sanitized.ndjson:L1"
    ],
    "evidence_digest": "b69b3a20b9371ee1a6d73c0a3fa4a1147799cf85a8d0ffba60f81d00c754e5f3"
  },
  {
    "schema_version": "1.0.0",
    "event_id": "hk-00000000000240028000000000000002",
    "event_type": "tool.execute.before",
    "hook_class": "OBSERVE",
    "phase": "before",
    "domain": "tool",
    "action": "execute",
    "occurred_at": "2026-09-19T08:41:06Z",
    "source": "kilo",
    "source_version": "7.7.2",
    "device_id": "device-01",
    "host_os": "windows",
    "privacy_class": "INTERNAL",
    "harness_id": "kilo-cli",
    "model_id": "cointh-glm/glm-5.3",
    "correlation_id": "kilo-fixture-session-0001",
    "dedupe_key": "kilo:kilo-fixture-session-0001:c8c2adac96e5b04e",
    "evidence_refs": [
      "runs/WO-P1-262/author/attempt-0001/kilo-sanitized.ndjson:L2"
    ],
    "evidence_digest": "c8c2adac96e5b04e158a3cd2d760103d7453a9618c4ffecc5e3791751d274469",
    "command_digest": "c56c189757b235c03bc89ee5c114e45628b6395f43df898ce2085c97f9a7b6d5",
    "summary": "kilo tool bash running (input redacted)"
  },
  {
    "schema_version": "1.0.0",
    "event_id": "hk-00000000000340038000000000000003",
    "event_type": "tool.execute.after",
    "hook_class": "OBSERVE",
    "phase": "after",
    "domain": "tool",
    "action": "execute",
    "occurred_at": "2026-09-19T08:41:04Z",
    "source": "kilo",
    "source_version": "7.7.2",
    "device_id": "device-01",
    "host_os": "windows",
    "privacy_class": "INTERNAL",
    "harness_id": "kilo-cli",
    "model_id": "cointh-glm/glm-5.3",
    "correlation_id": "kilo-fixture-session-0001",
    "dedupe_key": "kilo:kilo-fixture-session-0001:b596bb8cd9e7bb0c",
    "evidence_refs": [
      "runs/WO-P1-262/author/attempt-0001/kilo-sanitized.ndjson:L3"
    ],
    "evidence_digest": "b596bb8cd9e7bb0c8ee60e8c3ed4f50469d558e01f72da505d7f327f15ca2367",
    "command_digest": "755636e04ce96420d3c889f2c853e68a6ff6e85aff57601fa751672990eac952",
    "summary": "kilo tool read completed (input/output redacted)"
  },
  {
    "schema_version": "1.0.0",
    "event_id": "hk-00000000000440048000000000000004",
    "event_type": "tool.execute.after",
    "hook_class": "OBSERVE",
    "phase": "after",
    "domain": "tool",
    "action": "execute",
    "occurred_at": "2026-09-19T08:41:07.500Z",
    "source": "kilo",
    "source_version": "7.7.2",
    "device_id": "device-01",
    "host_os": "windows",
    "privacy_class": "INTERNAL",
    "harness_id": "kilo-cli",
    "model_id": "cointh-glm/glm-5.3",
    "correlation_id": "kilo-fixture-session-0001",
    "dedupe_key": "kilo:kilo-fixture-session-0001:d0c3ba4d574fcf45",
    "evidence_refs": [
      "runs/WO-P1-262/author/attempt-0001/kilo-sanitized.ndjson:L4"
    ],
    "evidence_digest": "d0c3ba4d574fcf456acbed1a047baf5e89d393c8f8466386aa17a3e389bb9d4e",
    "command_digest": "b7fcf288eacb7454c8e2ee2d2fcbd42cc67a538b492c2a04bc315e698353de74",
    "state": "FAILED",
    "blocker_code": "KILO_TOOL_FAILED",
    "summary": "kilo tool bash failed (input/output redacted)"
  },
  {
    "schema_version": "1.0.0",
    "event_id": "hk-00000000000540058000000000000005",
    "event_type": "execution.message",
    "hook_class": "OBSERVE",
    "phase": "within",
    "domain": "execution",
    "action": "message",
    "occurred_at": "2026-09-19T08:41:08.250Z",
    "source": "kilo",
    "source_version": "7.7.2",
    "device_id": "device-01",
    "host_os": "windows",
    "privacy_class": "INTERNAL",
    "harness_id": "kilo-cli",
    "model_id": "cointh-glm/glm-5.3",
    "correlation_id": "kilo-fixture-session-0001",
    "dedupe_key": "kilo:kilo-fixture-session-0001:000f0698d095323f",
    "evidence_refs": [
      "runs/WO-P1-262/author/attempt-0001/kilo-sanitized.ndjson:L5"
    ],
    "evidence_digest": "000f0698d095323fa5bf1ee6dd4d79b6ce2ad389f7c010ff1f80d7ab6c922cae",
    "summary": "kilo text part (redacted, digest only)"
  }
]
